{
    "$id": "https://w3id.org/pathogen/schemas/DGCVaccine.json",
    "$schema": "http://json-schema.org/draft-07/schema#",
    "$comment": "{\"term\": \"DGCVaccine\", \"@id\": \"https://w3id.org/pathogen#DGCVaccine\"}",
    "title": "DGCVaccine",
    "description": "Vaccine information",
    "type": "object",
    "properties": {
        "@context": {
            "type": "array"
        },
        "type": {
            "oneOf": [
                {
                    "type": "string"
                },
                {
                    "type": "array"
                }
            ]
        },
        "code" : {
            "$comment": "{\"term\": \"code\", \"@id\": \"http://id.who.int/icd/entity/164949870\"}",
            "title": "Vaccine code",
            "description": "Vaccine code",
            "type": "string"
        },
        "targetDisease" : {
            "$comment": "{\"term\": \"targetDisease\", \"@id\": \"http://hl7.org/fhir/Immunization.protocolApplied.targetedDisease\"}",
            "title": "Targeted Disease",
            "description": "Disease targeted by this vaccine",
            "type": "string"
        },
        "marketingAuthHolder" : {
            "$comment": "{\"term\": \"marketingAuthHolder\", \"@id\": \"http://hl7.eu/fhir/ig/dgc/ValueSet/vaccines-covid-19-auth-holders\"}",
            "title": "Marketing Auth holder",
            "description": "Marketing Auth holder",
            "type": "string"
        },
        "medicinalProductName" : {
            "$comment": "{\"term\": \"medicinalProductName\", \"@id\": \"http://hl7.eu/fhir/ig/dgc/ValueSet/vaccines-covid-19-names\"}",
            "title": "Product name",
            "description": "Product or Trade name used for the vaccine",
            "type": "string"
        }
    },
    "additionalProperties": false,
    "examples": []
}